{"stage": "feateng", "patch": "add_per_client_rank", "hash": "c9dc59f79806", "auc_mean": 0.58647, "auc_std": 0.05909, "auc_folds": [0.6574, 0.60642, 0.60373, 0.53908, 0.52224, 0.50832, 0.67237, 0.59424, 0.60681, 0.51323, 0.52409, 0.59447, 0.70697, 0.54103, 0.60661], "p50_mean": 0.78, "p50_folds": [0.78, 0.9, 0.76, 0.86, 0.78, 0.8, 0.92, 0.6, 0.76, 0.68, 0.78, 0.62, 0.82, 0.9, 0.74], "delta": -0.02315, "wins": 2, "wilcoxon_p": 0.9999, "decision": "revert", "seconds": 2.8, "config": {"population": "visible", "target": "binary", "num_impute": "zero", "num": ["content_age_days", "days_since_last_update", "word_count", "char_count", "search_volume", "competition", "cpc", "impressions_prev_30d", "clicks_prev_30d", "sessions_prev_30d"], "derived": ["per_client_rank"], "log1p_prev": true, "log1p_extra": [], "missing_flags": ["search_volume", "word_count"], "cats": ["content_type", "main_intent", "competition_level", "age_tier", "freshness_tier", "word_count_tier"], "encoder": "onehot", "scaler": "standard", "selection": null, "sample_weight": null, "model": "logreg", "model_params": {"class_weight": "balanced", "max_iter": 2000, "C": 1.0}}}
{"stage": "feateng", "patch": "add_client_agg", "hash": "cf40108a147f", "auc_mean": 0.57286, "auc_std": 0.07377, "auc_folds": [0.68132, 0.58959, 0.61626, 0.44206, 0.46842, 0.48968, 0.67542, 0.59293, 0.61007, 0.48963, 0.50337, 0.59304, 0.65073, 0.57025, 0.62019], "p50_mean": 0.7973, "p50_folds": [0.78, 0.84, 0.78, 0.8, 0.8, 0.88, 0.94, 0.68, 0.8, 0.6, 0.88, 0.68, 0.78, 0.88, 0.84], "delta": -0.03675, "wins": 4, "wilcoxon_p": 0.9966, "decision": "revert", "seconds": 2.7, "config": {"population": "visible", "target": "binary", "num_impute": "zero", "num": ["content_age_days", "days_since_last_update", "word_count", "char_count", "search_volume", "competition", "cpc", "impressions_prev_30d", "clicks_prev_30d", "sessions_prev_30d"], "derived": ["client_agg"], "log1p_prev": true, "log1p_extra": [], "missing_flags": ["search_volume", "word_count"], "cats": ["content_type", "main_intent", "competition_level", "age_tier", "freshness_tier", "word_count_tier"], "encoder": "onehot", "scaler": "standard", "selection": null, "sample_weight": null, "model": "logreg", "model_params": {"class_weight": "balanced", "max_iter": 2000, "C": 1.0}}}
{"stage": "sampling", "patch": "cw_none", "hash": "41d956531156", "auc_mean": 0.60934, "auc_std": 0.052, "auc_folds": [0.66734, 0.62386, 0.61858, 0.60175, 0.57539, 0.53888, 0.68773, 0.59286, 0.62331, 0.55516, 0.55633, 0.59071, 0.73186, 0.55563, 0.62067], "p50_mean": 0.8, "p50_folds": [0.7, 0.78, 0.84, 0.92, 0.88, 0.86, 0.94, 0.64, 0.84, 0.58, 0.86, 0.64, 0.9, 0.8, 0.82], "delta": -0.00028, "wins": 6, "wilcoxon_p": 0.7894, "decision": "revert", "seconds": 2.1, "config": {"population": "visible", "target": "binary", "num_impute": "zero", "num": ["content_age_days", "days_since_last_update", "word_count", "char_count", "search_volume", "competition", "cpc", "impressions_prev_30d", "clicks_prev_30d", "sessions_prev_30d"], "derived": ["keyword_composites"], "log1p_prev": true, "log1p_extra": [], "missing_flags": ["search_volume", "word_count"], "cats": ["content_type", "main_intent", "competition_level", "age_tier", "freshness_tier", "word_count_tier"], "encoder": "onehot", "scaler": "standard", "selection": null, "sample_weight": null, "model": "logreg", "model_params": {"class_weight": null, "max_iter": 2000, "C": 1.0}}}
{"stage": "sampling", "patch": "sw_prev_traffic", "hash": "f1eea4211cb7", "auc_mean": 0.597, "auc_std": 0.05991, "auc_folds": [0.65987, 0.62692, 0.61682, 0.58367, 0.54226, 0.51042, 0.67341, 0.58986, 0.6241, 0.51606, 0.53167, 0.58933, 0.72909, 0.54576, 0.61577], "p50_mean": 0.8067, "p50_folds": [0.68, 0.9, 0.82, 0.9, 0.84, 0.84, 0.94, 0.66, 0.8, 0.58, 0.86, 0.66, 0.88, 0.92, 0.82], "delta": -0.01262, "wins": 1, "wilcoxon_p": 0.9998, "decision": "revert", "seconds": 1.8, "config": {"population": "visible", "target": "binary", "num_impute": "zero", "num": ["content_age_days", "days_since_last_update", "word_count", "char_count", "search_volume", "competition", "cpc", "impressions_prev_30d", "clicks_prev_30d", "sessions_prev_30d"], "derived": ["keyword_composites"], "log1p_prev": true, "log1p_extra": [], "missing_flags": ["search_volume", "word_count"], "cats": ["content_type", "main_intent", "competition_level", "age_tier", "freshness_tier", "word_count_tier"], "encoder": "onehot", "scaler": "standard", "selection": null, "sample_weight": {"kind": "prev_traffic"}, "model": "logreg", "model_params": {"class_weight": "balanced", "max_iter": 2000, "C": 1.0}}}
{"stage": "sampling", "patch": "sw_confidence", "hash": "ad3519f56f0d", "auc_mean": 0.6034, "auc_std": 0.05733, "auc_folds": [0.6681, 0.60399, 0.61722, 0.62031, 0.56495, 0.5203, 0.67359, 0.57236, 0.61976, 0.56761, 0.53994, 0.57176, 0.74458, 0.54421, 0.62237], "p50_mean": 0.812, "p50_folds": [0.7, 0.8, 0.8, 0.96, 0.86, 0.88, 0.94, 0.64, 0.8, 0.68, 0.88, 0.62, 0.96, 0.84, 0.82], "delta": -0.00622, "wins": 3, "wilcoxon_p": 0.9584, "decision": "revert", "seconds": 1.9, "config": {"population": "visible", "target": "binary", "num_impute": "zero", "num": ["content_age_days", "days_since_last_update", "word_count", "char_count", "search_volume", "competition", "cpc", "impressions_prev_30d", "clicks_prev_30d", "sessions_prev_30d"], "derived": ["keyword_composites"], "log1p_prev": true, "log1p_extra": [], "missing_flags": ["search_volume", "word_count"], "cats": ["content_type", "main_intent", "competition_level", "age_tier", "freshness_tier", "word_count_tier"], "encoder": "onehot", "scaler": "standard", "selection": null, "sample_weight": {"kind": "confidence", "floor": 5}, "model": "logreg", "model_params": {"class_weight": "balanced", "max_iter": 2000, "C": 1.0}}}
{"stage": "sampling", "patch": "sw_per_client", "hash": "2cfde2b512a4", "auc_mean": 0.58997, "auc_std": 0.05567, "auc_folds": [0.67748, 0.62592, 0.54363, 0.57048, 0.55295, 0.53209, 0.6862, 0.59837, 0.52909, 0.62416, 0.52592, 0.59557, 0.6804, 0.57753, 0.52981], "p50_mean": 0.7787, "p50_folds": [0.76, 0.8, 0.7, 0.96, 0.86, 0.88, 0.82, 0.74, 0.54, 0.88, 0.8, 0.74, 0.8, 0.82, 0.58], "delta": -0.01965, "wins": 6, "wilcoxon_p": 0.9323, "decision": "revert", "seconds": 1.9, "config": {"population": "visible", "target": "binary", "num_impute": "zero", "num": ["content_age_days", "days_since_last_update", "word_count", "char_count", "search_volume", "competition", "cpc", "impressions_prev_30d", "clicks_prev_30d", "sessions_prev_30d"], "derived": ["keyword_composites"], "log1p_prev": true, "log1p_extra": [], "missing_flags": ["search_volume", "word_count"], "cats": ["content_type", "main_intent", "competition_level", "age_tier", "freshness_tier", "word_count_tier"], "encoder": "onehot", "scaler": "standard", "selection": null, "sample_weight": {"kind": "per_client", "alpha": 1.0}, "model": "logreg", "model_params": {"class_weight": "balanced", "max_iter": 2000, "C": 1.0}}}
{"stage": "sampling", "patch": "target_3class", "hash": "6e287934f754", "auc_mean": 0.60615, "auc_std": 0.0596, "auc_folds": [0.68325, 0.62237, 0.61631, 0.59802, 0.56085, 0.5236, 0.6883, 0.58966, 0.62288, 0.54117, 0.54004, 0.58931, 0.74402, 0.55418, 0.6183], "p50_mean": 0.8067, "p50_folds": [0.7, 0.9, 0.78, 0.92, 0.86, 0.86, 0.94, 0.62, 0.82, 0.64, 0.88, 0.64, 0.88, 0.86, 0.8], "delta": -0.00347, "wins": 2, "wilcoxon_p": 0.9823, "decision": "revert", "seconds": 13.7, "config": {"population": "visible", "target": "3class", "num_impute": "zero", "num": ["content_age_days", "days_since_last_update", "word_count", "char_count", "search_volume", "competition", "cpc", "impressions_prev_30d", "clicks_prev_30d", "sessions_prev_30d"], "derived": ["keyword_composites"], "log1p_prev": true, "log1p_extra": [], "missing_flags": ["search_volume", "word_count"], "cats": ["content_type", "main_intent", "competition_level", "age_tier", "freshness_tier", "word_count_tier"], "encoder": "onehot", "scaler": "standard", "selection": null, "sample_weight": null, "model": "logreg", "model_params": {"class_weight": "balanced", "max_iter": 2000, "C": 1.0}}}
{"stage": "sampling", "patch": "target_regress", "hash": "ba9f064b5f7e", "auc_mean": 0.59367, "auc_std": 0.06127, "auc_folds": [0.66578, 0.58787, 0.61654, 0.57849, 0.55302, 0.49443, 0.67026, 0.57394, 0.62058, 0.54117, 0.51665, 0.57332, 0.73765, 0.55658, 0.61885], "p50_mean": 0.772, "p50_folds": [0.76, 0.74, 0.8, 0.94, 0.72, 0.8, 0.9, 0.6, 0.8, 0.7, 0.78, 0.58, 0.96, 0.72, 0.78], "delta": -0.01595, "wins": 2, "wilcoxon_p": 0.9996, "decision": "veto_p50", "seconds": 0.7, "config": {"population": "visible", "target": "regress_trend", "num_impute": "zero", "num": ["content_age_days", "days_since_last_update", "word_count", "char_count", "search_volume", "competition", "cpc", "impressions_prev_30d", "clicks_prev_30d", "sessions_prev_30d"], "derived": ["keyword_composites"], "log1p_prev": true, "log1p_extra": [], "missing_flags": ["search_volume", "word_count"], "cats": ["content_type", "main_intent", "competition_level", "age_tier", "freshness_tier", "word_count_tier"], "encoder": "onehot", "scaler": "standard", "selection": null, "sample_weight": null, "model": "logreg", "model_params": {"class_weight": "balanced", "max_iter": 2000, "C": 1.0}}}
{"stage": "sampling", "patch": "widen_all", "hash": "cadf7ccc31dd", "auc_mean": 0.61567, "auc_std": 0.03801, "auc_folds": [0.58335, 0.61703, 0.6085, 0.63312, 0.63416, 0.69949, 0.59942, 0.56694, 0.66267, 0.6466, 0.56165, 0.59913, 0.5585, 0.63881, 0.62567], "p50_mean": 0.8013, "p50_folds": [0.84, 0.9, 0.72, 0.78, 0.5, 0.92, 0.72, 0.76, 0.84, 0.96, 0.76, 0.9, 0.74, 0.94, 0.74], "delta": 0.01569, "wins": 8, "wilcoxon_p": 0.1384, "decision": "revert", "seconds": 3.8, "config": {"population": "widen_all", "target": "binary", "num_impute": "zero", "num": ["content_age_days", "days_since_last_update", "word_count", "char_count", "search_volume", "competition", "cpc", "impressions_prev_30d", "clicks_prev_30d", "sessions_prev_30d"], "derived": ["keyword_composites"], "log1p_prev": true, "log1p_extra": [], "missing_flags": ["search_volume", "word_count"], "cats": ["content_type", "main_intent", "competition_level", "age_tier", "freshness_tier", "word_count_tier"], "encoder": "onehot", "scaler": "standard", "selection": null, "sample_weight": null, "model": "logreg", "model_params": {"class_weight": "balanced", "max_iter": 2000, "C": 1.0}}}
{"stage": "sampling", "patch": "widen_downweight", "hash": "24e0cfccfa06", "auc_mean": 0.59737, "auc_std": 0.04715, "auc_folds": [0.50826, 0.57269, 0.60429, 0.67807, 0.56069, 0.61175, 0.59581, 0.57156, 0.6201, 0.66752, 0.54494, 0.58226, 0.55066, 0.6645, 0.62747], "p50_mean": 0.7307, "p50_folds": [0.6, 0.88, 0.84, 0.74, 0.48, 0.7, 0.78, 0.46, 0.94, 0.7, 0.64, 0.82, 0.64, 0.96, 0.78], "delta": -0.00261, "wins": 4, "wilcoxon_p": 0.8738, "decision": "revert", "seconds": 4.1, "config": {"population": "widen_all", "target": "binary", "num_impute": "zero", "num": ["content_age_days", "days_since_last_update", "word_count", "char_count", "search_volume", "competition", "cpc", "impressions_prev_30d", "clicks_prev_30d", "sessions_prev_30d"], "derived": ["keyword_composites"], "log1p_prev": true, "log1p_extra": [], "missing_flags": ["search_volume", "word_count"], "cats": ["content_type", "main_intent", "competition_level", "age_tier", "freshness_tier", "word_count_tier"], "encoder": "onehot", "scaler": "standard", "selection": null, "sample_weight": {"kind": "prev_traffic"}, "model": "logreg", "model_params": {"class_weight": "balanced", "max_iter": 2000, "C": 1.0}}}
{"stage": "model", "patch": "logreg_C0.3", "hash": "61cfa5cf5267", "auc_mean": 0.61138, "auc_std": 0.05241, "auc_folds": [0.66865, 0.62591, 0.62035, 0.60776, 0.57855, 0.54351, 0.69261, 0.59081, 0.62561, 0.55408, 0.5609, 0.58932, 0.73438, 0.55544, 0.62278], "p50_mean": 0.812, "p50_folds": [0.72, 0.82, 0.82, 0.92, 0.9, 0.9, 0.94, 0.64, 0.84, 0.6, 0.88, 0.66, 0.9, 0.82, 0.82], "delta": 0.00176, "wins": 9, "wilcoxon_p": 0.0319, "decision": "revert", "seconds": 1.6, "config": {"population": "visible", "target": "binary", "num_impute": "zero", "num": ["content_age_days", "days_since_last_update", "word_count", "char_count", "search_volume", "competition", "cpc", "impressions_prev_30d", "clicks_prev_30d", "sessions_prev_30d"], "derived": ["keyword_composites"], "log1p_prev": true, "log1p_extra": [], "missing_flags": ["search_volume", "word_count"], "cats": ["content_type", "main_intent", "competition_level", "age_tier", "freshness_tier", "word_count_tier"], "encoder": "onehot", "scaler": "standard", "selection": null, "sample_weight": null, "model": "logreg", "model_params": {"class_weight": "balanced", "max_iter": 2000, "C": 0.3}}}
{"stage": "model", "patch": "logreg_C3", "hash": "c9b7fd7b34ca", "auc_mean": 0.60883, "auc_std": 0.05216, "auc_folds": [0.66915, 0.62376, 0.62061, 0.59483, 0.57541, 0.53659, 0.68477, 0.59354, 0.62552, 0.55205, 0.55378, 0.59395, 0.72942, 0.55611, 0.62295], "p50_mean": 0.7987, "p50_folds": [0.7, 0.8, 0.82, 0.92, 0.82, 0.86, 0.94, 0.66, 0.84, 0.62, 0.86, 0.66, 0.86, 0.8, 0.82], "delta": -0.00079, "wins": 5, "wilcoxon_p": 0.9062, "decision": "revert", "seconds": 1.9, "config": {"population": "visible", "target": "binary", "num_impute": "zero", "num": ["content_age_days", "days_since_last_update", "word_count", "char_count", "search_volume", "competition", "cpc", "impressions_prev_30d", "clicks_prev_30d", "sessions_prev_30d"], "derived": ["keyword_composites"], "log1p_prev": true, "log1p_extra": [], "missing_flags": ["search_volume", "word_count"], "cats": ["content_type", "main_intent", "competition_level", "age_tier", "freshness_tier", "word_count_tier"], "encoder": "onehot", "scaler": "standard", "selection": null, "sample_weight": null, "model": "logreg", "model_params": {"class_weight": "balanced", "max_iter": 2000, "C": 3.0}}}
{"stage": "model", "patch": "logreg_l1", "hash": "c6f8eff87055", "auc_mean": 0.61017, "auc_std": 0.05327, "auc_folds": [0.67095, 0.62585, 0.62067, 0.60347, 0.57343, 0.53526, 0.69079, 0.59071, 0.62592, 0.55722, 0.55344, 0.59043, 0.7331, 0.55822, 0.6231], "p50_mean": 0.8027, "p50_folds": [0.7, 0.82, 0.82, 0.92, 0.86, 0.86, 0.94, 0.64, 0.84, 0.6, 0.88, 0.66, 0.86, 0.82, 0.82], "delta": 0.00055, "wins": 10, "wilcoxon_p": 0.2106, "decision": "revert", "seconds": 387.6, "config": {"population": "visible", "target": "binary", "num_impute": "zero", "num": ["content_age_days", "days_since_last_update", "word_count", "char_count", "search_volume", "competition", "cpc", "impressions_prev_30d", "clicks_prev_30d", "sessions_prev_30d"], "derived": ["keyword_composites"], "log1p_prev": true, "log1p_extra": [], "missing_flags": ["search_volume", "word_count"], "cats": ["content_type", "main_intent", "competition_level", "age_tier", "freshness_tier", "word_count_tier"], "encoder": "onehot", "scaler": "standard", "selection": null, "sample_weight": null, "model": "logreg_saga", "model_params": {"class_weight": "balanced", "max_iter": 3000, "penalty": "l1", "C": 1.0}}}
{"stage": "model", "patch": "lda", "hash": "8f99b9f476f8", "auc_mean": 0.60725, "auc_std": 0.05229, "auc_folds": [0.66761, 0.61738, 0.62032, 0.58232, 0.58029, 0.53688, 0.68914, 0.5886, 0.62489, 0.53493, 0.5527, 0.58869, 0.72468, 0.57791, 0.62243], "p50_mean": 0.784, "p50_folds": [0.74, 0.76, 0.76, 0.9, 0.82, 0.86, 0.98, 0.62, 0.78, 0.72, 0.84, 0.64, 0.86, 0.68, 0.8], "delta": -0.00237, "wins": 3, "wilcoxon_p": 0.9723, "decision": "revert", "seconds": 1.6, "config": {"population": "visible", "target": "binary", "num_impute": "zero", "num": ["content_age_days", "days_since_last_update", "word_count", "char_count", "search_volume", "competition", "cpc", "impressions_prev_30d", "clicks_prev_30d", "sessions_prev_30d"], "derived": ["keyword_composites"], "log1p_prev": true, "log1p_extra": [], "missing_flags": ["search_volume", "word_count"], "cats": ["content_type", "main_intent", "competition_level", "age_tier", "freshness_tier", "word_count_tier"], "encoder": "onehot", "scaler": "standard", "selection": null, "sample_weight": null, "model": "lda", "model_params": {}}}
{"stage": "model", "patch": "gnb", "hash": "55aec07b07e0", "auc_mean": 0.53639, "auc_std": 0.0686, "auc_folds": [0.5686, 0.60601, 0.5849, 0.53719, 0.4558, 0.40701, 0.61688, 0.54601, 0.58817, 0.43794, 0.42933, 0.54525, 0.61983, 0.52688, 0.57612], "p50_mean": 0.5813, "p50_folds": [0.7, 0.6, 0.56, 0.68, 0.58, 0.56, 0.72, 0.46, 0.44, 0.66, 0.56, 0.48, 0.64, 0.58, 0.5], "delta": -0.07322, "wins": 0, "wilcoxon_p": 1.0, "decision": "veto_p50", "seconds": 1.2, "config": {"population": "visible", "target": "binary", "num_impute": "zero", "num": ["content_age_days", "days_since_last_update", "word_count", "char_count", "search_volume", "competition", "cpc", "impressions_prev_30d", "clicks_prev_30d", "sessions_prev_30d"], "derived": ["keyword_composites"], "log1p_prev": true, "log1p_extra": [], "missing_flags": ["search_volume", "word_count"], "cats": ["content_type", "main_intent", "competition_level", "age_tier", "freshness_tier", "word_count_tier"], "encoder": "onehot", "scaler": "standard", "selection": null, "sample_weight": null, "model": "gnb", "model_params": {}}}
{"stage": "model", "patch": "knn", "hash": "a46383030b2d", "auc_mean": 0.57329, "auc_std": 0.06659, "auc_folds": [0.67138, 0.61086, 0.51355, 0.59847, 0.53547, 0.51901, 0.67743, 0.59523, 0.52863, 0.4739, 0.53073, 0.59201, 0.70227, 0.53716, 0.51328], "p50_mean": 0.768, "p50_folds": [0.68, 0.84, 0.74, 0.94, 0.84, 0.82, 0.92, 0.54, 0.72, 0.64, 0.76, 0.52, 0.98, 0.82, 0.76], "delta": -0.03633, "wins": 3, "wilcoxon_p": 0.9996, "decision": "veto_p50", "seconds": 4.3, "config": {"population": "visible", "target": "binary", "num_impute": "zero", "num": ["content_age_days", "days_since_last_update", "word_count", "char_count", "search_volume", "competition", "cpc", "impressions_prev_30d", "clicks_prev_30d", "sessions_prev_30d"], "derived": ["keyword_composites"], "log1p_prev": true, "log1p_extra": [], "missing_flags": ["search_volume", "word_count"], "cats": ["content_type", "main_intent", "competition_level", "age_tier", "freshness_tier", "word_count_tier"], "encoder": "onehot", "scaler": "standard", "selection": null, "sample_weight": null, "model": "knn", "model_params": {"n_neighbors": 50, "weights": "distance"}}}
{"stage": "model", "patch": "rf", "hash": "17f1ca7c2258", "auc_mean": 0.60504, "auc_std": 0.05311, "auc_folds": [0.69345, 0.61279, 0.59989, 0.55497, 0.56762, 0.54668, 0.69514, 0.61889, 0.60145, 0.53874, 0.5545, 0.61213, 0.70908, 0.57643, 0.59392], "p50_mean": 0.7213, "p50_folds": [0.7, 0.82, 0.74, 0.82, 0.7, 0.74, 0.84, 0.56, 0.76, 0.44, 0.72, 0.56, 0.88, 0.78, 0.76], "delta": -0.00457, "wins": 6, "wilcoxon_p": 0.7729, "decision": "veto_p50", "seconds": 114.3, "config": {"population": "visible", "target": "binary", "num_impute": "zero", "num": ["content_age_days", "days_since_last_update", "word_count", "char_count", "search_volume", "competition", "cpc", "impressions_prev_30d", "clicks_prev_30d", "sessions_prev_30d"], "derived": ["keyword_composites"], "log1p_prev": true, "log1p_extra": [], "missing_flags": ["search_volume", "word_count"], "cats": ["content_type", "main_intent", "competition_level", "age_tier", "freshness_tier", "word_count_tier"], "encoder": "onehot", "scaler": "standard", "selection": null, "sample_weight": null, "model": "rf", "model_params": {"n_estimators": 400, "max_depth": null, "min_samples_leaf": 5, "class_weight": "balanced"}}}
{"stage": "model", "patch": "extratrees", "hash": "4f14534a7f26", "auc_mean": 0.56687, "auc_std": 0.0553, "auc_folds": [0.64838, 0.60757, 0.57512, 0.53111, 0.51662, 0.48556, 0.65527, 0.57911, 0.57661, 0.47749, 0.51048, 0.57761, 0.65065, 0.54039, 0.57104], "p50_mean": 0.7227, "p50_folds": [0.68, 0.78, 0.74, 0.9, 0.84, 0.76, 0.76, 0.64, 0.72, 0.28, 0.76, 0.6, 0.84, 0.84, 0.7], "delta": -0.04275, "wins": 0, "wilcoxon_p": 1.0, "decision": "veto_p50", "seconds": 58.1, "config": {"population": "visible", "target": "binary", "num_impute": "zero", "num": ["content_age_days", "days_since_last_update", "word_count", "char_count", "search_volume", "competition", "cpc", "impressions_prev_30d", "clicks_prev_30d", "sessions_prev_30d"], "derived": ["keyword_composites"], "log1p_prev": true, "log1p_extra": [], "missing_flags": ["search_volume", "word_count"], "cats": ["content_type", "main_intent", "competition_level", "age_tier", "freshness_tier", "word_count_tier"], "encoder": "onehot", "scaler": "standard", "selection": null, "sample_weight": null, "model": "extratrees", "model_params": {"n_estimators": 400, "min_samples_leaf": 5, "class_weight": "balanced"}}}
{"stage": "model", "patch": "histgb", "hash": "8a89907c98e0", "auc_mean": 0.60334, "auc_std": 0.04887, "auc_folds": [0.67175, 0.59845, 0.61097, 0.52609, 0.5825, 0.55625, 0.66573, 0.61321, 0.62046, 0.55347, 0.55008, 0.62132, 0.70606, 0.5603, 0.61351], "p50_mean": 0.72, "p50_folds": [0.68, 0.8, 0.76, 0.6, 0.88, 0.88, 0.72, 0.66, 0.76, 0.3, 0.78, 0.64, 0.76, 0.8, 0.78], "delta": -0.00627, "wins": 7, "wilcoxon_p": 0.8053, "decision": "veto_p50", "seconds": 7.9, "config": {"population": "visible", "target": "binary", "num_impute": "zero", "num": ["content_age_days", "days_since_last_update", "word_count", "char_count", "search_volume", "competition", "cpc", "impressions_prev_30d", "clicks_prev_30d", "sessions_prev_30d"], "derived": ["keyword_composites"], "log1p_prev": true, "log1p_extra": [], "missing_flags": ["search_volume", "word_count"], "cats": ["content_type", "main_intent", "competition_level", "age_tier", "freshness_tier", "word_count_tier"], "encoder": "onehot", "scaler": "standard", "selection": null, "sample_weight": null, "model": "histgb", "model_params": {"learning_rate": 0.05, "max_iter": 400, "max_leaf_nodes": 31, "l2_regularization": 1.0, "early_stopping": true}}}
