{"stage": "model", "patch": "histgb_deep", "hash": "566e03541d9a", "auc_mean": 0.60246, "auc_std": 0.04895, "auc_folds": [0.67713, 0.60265, 0.60385, 0.52343, 0.58387, 0.54919, 0.6663, 0.61606, 0.616, 0.55073, 0.55691, 0.62329, 0.69808, 0.55703, 0.61231], "p50_mean": 0.7227, "p50_folds": [0.72, 0.8, 0.72, 0.62, 0.84, 0.9, 0.8, 0.62, 0.7, 0.36, 0.82, 0.64, 0.74, 0.82, 0.74], "delta": -0.00716, "wins": 7, "wilcoxon_p": 0.7729, "decision": "veto_p50", "seconds": 17.7, "config": {"population": "visible", "target": "binary", "num_impute": "zero", "num": ["content_age_days", "days_since_last_update", "word_count", "char_count", "search_volume", "competition", "cpc", "impressions_prev_30d", "clicks_prev_30d", "sessions_prev_30d"], "derived": ["keyword_composites"], "log1p_prev": true, "log1p_extra": [], "missing_flags": ["search_volume", "word_count"], "cats": ["content_type", "main_intent", "competition_level", "age_tier", "freshness_tier", "word_count_tier"], "encoder": "onehot", "scaler": "standard", "selection": null, "sample_weight": null, "model": "histgb", "model_params": {"learning_rate": 0.03, "max_iter": 600, "max_leaf_nodes": 63, "l2_regularization": 2.0, "early_stopping": true}}}
{"stage": "model", "patch": "gradientboosting", "hash": "8b7f3e993181", "auc_mean": 0.5923, "auc_std": 0.05782, "auc_folds": [0.66484, 0.57266, 0.60606, 0.54089, 0.57814, 0.54825, 0.68117, 0.52816, 0.6135, 0.56538, 0.55154, 0.52835, 0.73246, 0.56565, 0.60746], "p50_mean": 0.7773, "p50_folds": [0.64, 0.82, 0.78, 0.84, 0.92, 0.86, 0.82, 0.66, 0.76, 0.5, 0.9, 0.66, 0.94, 0.78, 0.78], "delta": -0.01732, "wins": 5, "wilcoxon_p": 0.9794, "decision": "revert", "seconds": 169.5, "config": {"population": "visible", "target": "binary", "num_impute": "zero", "num": ["content_age_days", "days_since_last_update", "word_count", "char_count", "search_volume", "competition", "cpc", "impressions_prev_30d", "clicks_prev_30d", "sessions_prev_30d"], "derived": ["keyword_composites"], "log1p_prev": true, "log1p_extra": [], "missing_flags": ["search_volume", "word_count"], "cats": ["content_type", "main_intent", "competition_level", "age_tier", "freshness_tier", "word_count_tier"], "encoder": "onehot", "scaler": "standard", "selection": null, "sample_weight": null, "model": "gradientboosting", "model_params": {"n_estimators": 300, "learning_rate": 0.05, "max_depth": 3}}}
{"stage": "model", "patch": "mlp", "hash": "4a7af392fb0f", "auc_mean": 0.61009, "auc_std": 0.05033, "auc_folds": [0.67747, 0.61253, 0.57843, 0.59333, 0.57493, 0.55303, 0.70325, 0.63259, 0.60665, 0.53626, 0.56582, 0.62984, 0.70873, 0.58271, 0.59582], "p50_mean": 0.7827, "p50_folds": [0.58, 0.86, 0.74, 0.9, 0.88, 0.9, 0.88, 0.62, 0.74, 0.64, 0.82, 0.64, 0.94, 0.8, 0.8], "delta": 0.00047, "wins": 7, "wilcoxon_p": 0.533, "decision": "revert", "seconds": 24.0, "config": {"population": "visible", "target": "binary", "num_impute": "zero", "num": ["content_age_days", "days_since_last_update", "word_count", "char_count", "search_volume", "competition", "cpc", "impressions_prev_30d", "clicks_prev_30d", "sessions_prev_30d"], "derived": ["keyword_composites"], "log1p_prev": true, "log1p_extra": [], "missing_flags": ["search_volume", "word_count"], "cats": ["content_type", "main_intent", "competition_level", "age_tier", "freshness_tier", "word_count_tier"], "encoder": "onehot", "scaler": "standard", "selection": null, "sample_weight": null, "model": "mlp", "model_params": {"hidden_layer_sizes": [64, 32], "alpha": 0.001, "early_stopping": true, "max_iter": 300}}}
{"stage": "final_greedy", "patch": "final", "hash": "08c5c56ae89a", "auc_mean": 0.60962, "auc_std": 0.05283, "auc_folds": [0.6693, 0.62435, 0.62052, 0.6009, 0.57622, 0.53755, 0.68887, 0.59228, 0.62559, 0.55174, 0.55538, 0.59059, 0.73219, 0.55585, 0.62296], "p50_mean": 0.804, "p50_folds": [0.7, 0.78, 0.82, 0.92, 0.88, 0.86, 0.94, 0.66, 0.84, 0.62, 0.86, 0.66, 0.88, 0.82, 0.82], "decision": "final_greedy", "config": {"population": "visible", "target": "binary", "num_impute": "zero", "num": ["content_age_days", "days_since_last_update", "word_count", "char_count", "search_volume", "competition", "cpc", "impressions_prev_30d", "clicks_prev_30d", "sessions_prev_30d"], "derived": ["keyword_composites"], "log1p_prev": true, "log1p_extra": [], "missing_flags": ["search_volume", "word_count"], "cats": ["content_type", "main_intent", "competition_level", "age_tier", "freshness_tier", "word_count_tier"], "encoder": "onehot", "scaler": "standard", "selection": null, "sample_weight": null, "model": "logreg", "model_params": {"class_weight": "balanced", "max_iter": 2000, "C": 1.0}}}
{"stage": "verify", "patch": "summary", "surviving": ["add_keyword_composites"], "base_fresh_auc": 0.60886, "final_fresh_auc": 0.60902, "perm_control_auc": 0.44399, "baseline_lockbox_auc": 0.66637, "baseline_lockbox_p50": 0.76, "final_lockbox_auc": 0.66375, "final_lockbox_p50": 0.78, "config": {"population": "visible", "target": "binary", "num_impute": "zero", "num": ["content_age_days", "days_since_last_update", "word_count", "char_count", "search_volume", "competition", "cpc", "impressions_prev_30d", "clicks_prev_30d", "sessions_prev_30d"], "derived": ["keyword_composites"], "log1p_prev": true, "log1p_extra": [], "missing_flags": ["search_volume", "word_count"], "cats": ["content_type", "main_intent", "competition_level"], "encoder": "onehot", "scaler": "standard", "selection": null, "sample_weight": null, "model": "logreg", "model_params": {"class_weight": "balanced", "max_iter": 2000, "C": 1.0}}, "decision": "verify"}
{"stage": "final_decision", "patch": "widen_all", "summary": "Train-population widening is the one robustly beneficial change. LogReg beats all 11 alt model families as a ranker. cats_add_tiers was fold-overfitting (pruned). keyword_composites neutral on lockbox.", "dev_cv": {"base_auc": 0.6033, "widen_auc": 0.6242, "base_p50": 0.824, "widen_p50": 0.855, "wins": "9/15"}, "fresh_cv": {"base_auc": 0.6042, "widen_auc": 0.6299, "wins": "11/15"}, "lockbox": {"base_auc": 0.6664, "widen_auc": 0.6677, "base_p50": 0.76, "widen_p50": 0.84}, "permutation_control": 0.478, "decision": "final_decision"}
