{"stage": "baseline", "patch": "baseline", "hash": "51be04db374f", "auc_mean": 0.60156, "auc_std": 0.06483, "auc_folds": [0.7002, 0.60003, 0.6239, 0.56307, 0.52993, 0.52089, 0.72058, 0.58483, 0.62825, 0.50067, 0.53696, 0.58564, 0.69878, 0.60699, 0.62269], "p50_mean": 0.7907, "p50_folds": [0.8, 0.7, 0.76, 0.92, 0.9, 0.92, 0.86, 0.58, 0.76, 0.74, 0.9, 0.6, 0.9, 0.72, 0.8], "decision": "baseline", "config": {"population": "visible", "target": "binary", "num_impute": "zero", "num": ["content_age_days", "days_since_last_update", "word_count", "char_count", "search_volume", "competition", "cpc", "impressions_prev_30d", "clicks_prev_30d", "sessions_prev_30d"], "derived": [], "log1p_prev": true, "log1p_extra": [], "missing_flags": ["search_volume", "word_count"], "cats": ["content_type", "main_intent", "competition_level"], "encoder": "onehot", "scaler": "standard", "selection": null, "sample_weight": null, "model": "logreg", "model_params": {"class_weight": "balanced", "max_iter": 2000, "C": 1.0}}}
{"stage": "preproc", "patch": "median_impute", "hash": "e6c846bcdbfb", "auc_mean": 0.60142, "auc_std": 0.06485, "auc_folds": [0.6997, 0.59978, 0.62387, 0.56235, 0.52984, 0.5207, 0.72148, 0.58487, 0.62826, 0.50117, 0.53603, 0.58566, 0.69776, 0.6071, 0.62275], "p50_mean": 0.7867, "p50_folds": [0.82, 0.68, 0.76, 0.92, 0.9, 0.92, 0.86, 0.58, 0.76, 0.74, 0.9, 0.6, 0.88, 0.7, 0.78], "delta": -0.00014, "wins": 7, "wilcoxon_p": 0.8486, "decision": "revert", "seconds": 1.7, "config": {"population": "visible", "target": "binary", "num_impute": "median", "num": ["content_age_days", "days_since_last_update", "word_count", "char_count", "search_volume", "competition", "cpc", "impressions_prev_30d", "clicks_prev_30d", "sessions_prev_30d"], "derived": [], "log1p_prev": true, "log1p_extra": [], "missing_flags": ["search_volume", "word_count"], "cats": ["content_type", "main_intent", "competition_level"], "encoder": "onehot", "scaler": "standard", "selection": null, "sample_weight": null, "model": "logreg", "model_params": {"class_weight": "balanced", "max_iter": 2000, "C": 1.0}}}
{"stage": "preproc", "patch": "mean_impute", "hash": "cda58ee9b928", "auc_mean": 0.60122, "auc_std": 0.06471, "auc_folds": [0.69949, 0.59995, 0.62397, 0.56216, 0.52971, 0.52072, 0.72147, 0.585, 0.62813, 0.50074, 0.53576, 0.58575, 0.69579, 0.60698, 0.62271], "p50_mean": 0.7867, "p50_folds": [0.82, 0.7, 0.78, 0.92, 0.9, 0.92, 0.86, 0.58, 0.74, 0.74, 0.9, 0.6, 0.86, 0.7, 0.78], "delta": -0.00034, "wins": 6, "wilcoxon_p": 0.9243, "decision": "revert", "seconds": 1.5, "config": {"population": "visible", "target": "binary", "num_impute": "mean", "num": ["content_age_days", "days_since_last_update", "word_count", "char_count", "search_volume", "competition", "cpc", "impressions_prev_30d", "clicks_prev_30d", "sessions_prev_30d"], "derived": [], "log1p_prev": true, "log1p_extra": [], "missing_flags": ["search_volume", "word_count"], "cats": ["content_type", "main_intent", "competition_level"], "encoder": "onehot", "scaler": "standard", "selection": null, "sample_weight": null, "model": "logreg", "model_params": {"class_weight": "balanced", "max_iter": 2000, "C": 1.0}}}
{"stage": "preproc", "patch": "scaler_robust", "hash": "a929e7e4d9dd", "auc_mean": 0.60113, "auc_std": 0.06429, "auc_folds": [0.70034, 0.60007, 0.6239, 0.55491, 0.53134, 0.52148, 0.72, 0.58578, 0.62788, 0.50348, 0.53739, 0.5865, 0.69552, 0.60568, 0.62269], "p50_mean": 0.7827, "p50_folds": [0.84, 0.68, 0.76, 0.92, 0.9, 0.9, 0.8, 0.58, 0.74, 0.74, 0.9, 0.58, 0.9, 0.72, 0.78], "delta": -0.00043, "wins": 9, "wilcoxon_p": 0.3808, "decision": "revert", "seconds": 18.4, "config": {"population": "visible", "target": "binary", "num_impute": "zero", "num": ["content_age_days", "days_since_last_update", "word_count", "char_count", "search_volume", "competition", "cpc", "impressions_prev_30d", "clicks_prev_30d", "sessions_prev_30d"], "derived": [], "log1p_prev": true, "log1p_extra": [], "missing_flags": ["search_volume", "word_count"], "cats": ["content_type", "main_intent", "competition_level"], "encoder": "onehot", "scaler": "robust", "selection": null, "sample_weight": null, "model": "logreg", "model_params": {"class_weight": "balanced", "max_iter": 2000, "C": 1.0}}}
{"stage": "preproc", "patch": "scaler_quantile_normal", "hash": "0c6707bdbbd7", "auc_mean": 0.55281, "auc_std": 0.0618, "auc_folds": [0.63482, 0.54261, 0.56985, 0.50773, 0.50322, 0.48865, 0.64851, 0.51142, 0.57174, 0.49842, 0.48771, 0.50978, 0.69689, 0.54623, 0.57463], "p50_mean": 0.7133, "p50_folds": [0.76, 0.7, 0.7, 0.8, 0.72, 0.84, 0.72, 0.54, 0.74, 0.72, 0.72, 0.54, 0.98, 0.68, 0.54], "delta": -0.04875, "wins": 0, "wilcoxon_p": 1.0, "decision": "veto_p50", "seconds": 4.5, "config": {"population": "visible", "target": "binary", "num_impute": "zero", "num": ["content_age_days", "days_since_last_update", "word_count", "char_count", "search_volume", "competition", "cpc", "impressions_prev_30d", "clicks_prev_30d", "sessions_prev_30d"], "derived": [], "log1p_prev": true, "log1p_extra": [], "missing_flags": ["search_volume", "word_count"], "cats": ["content_type", "main_intent", "competition_level"], "encoder": "onehot", "scaler": "quantile_normal", "selection": null, "sample_weight": null, "model": "logreg", "model_params": {"class_weight": "balanced", "max_iter": 2000, "C": 1.0}}}
{"stage": "preproc", "patch": "scaler_quantile_uniform", "hash": "e867a2557e7b", "auc_mean": 0.55803, "auc_std": 0.04555, "auc_folds": [0.62095, 0.54747, 0.58565, 0.55298, 0.52019, 0.48923, 0.62292, 0.53612, 0.5889, 0.50037, 0.48972, 0.53641, 0.62848, 0.56103, 0.59005], "p50_mean": 0.7627, "p50_folds": [0.78, 0.68, 0.68, 0.94, 0.88, 0.92, 0.74, 0.58, 0.72, 0.74, 0.88, 0.58, 0.9, 0.68, 0.74], "delta": -0.04353, "wins": 0, "wilcoxon_p": 1.0, "decision": "revert", "seconds": 2.1, "config": {"population": "visible", "target": "binary", "num_impute": "zero", "num": ["content_age_days", "days_since_last_update", "word_count", "char_count", "search_volume", "competition", "cpc", "impressions_prev_30d", "clicks_prev_30d", "sessions_prev_30d"], "derived": [], "log1p_prev": true, "log1p_extra": [], "missing_flags": ["search_volume", "word_count"], "cats": ["content_type", "main_intent", "competition_level"], "encoder": "onehot", "scaler": "quantile_uniform", "selection": null, "sample_weight": null, "model": "logreg", "model_params": {"class_weight": "balanced", "max_iter": 2000, "C": 1.0}}}
{"stage": "preproc", "patch": "scaler_power_yeo", "hash": "1844560e6a99", "auc_mean": 0.59736, "auc_std": 0.06484, "auc_folds": [0.70121, 0.6009, 0.60448, 0.57576, 0.53512, 0.50036, 0.70341, 0.59133, 0.60804, 0.52188, 0.51703, 0.59108, 0.71863, 0.5862, 0.60502], "p50_mean": 0.7813, "p50_folds": [0.82, 0.62, 0.78, 0.92, 0.92, 0.92, 0.76, 0.58, 0.82, 0.74, 0.92, 0.56, 0.86, 0.74, 0.76], "delta": -0.0042, "wins": 8, "wilcoxon_p": 0.7894, "decision": "revert", "seconds": 6.4, "config": {"population": "visible", "target": "binary", "num_impute": "zero", "num": ["content_age_days", "days_since_last_update", "word_count", "char_count", "search_volume", "competition", "cpc", "impressions_prev_30d", "clicks_prev_30d", "sessions_prev_30d"], "derived": [], "log1p_prev": true, "log1p_extra": [], "missing_flags": ["search_volume", "word_count"], "cats": ["content_type", "main_intent", "competition_level"], "encoder": "onehot", "scaler": "power_yeo", "selection": null, "sample_weight": null, "model": "logreg", "model_params": {"class_weight": "balanced", "max_iter": 2000, "C": 1.0}}}
{"stage": "preproc", "patch": "scaler_maxabs", "hash": "156ff8a765bd", "auc_mean": 0.59821, "auc_std": 0.06627, "auc_folds": [0.69464, 0.60533, 0.62723, 0.5477, 0.52814, 0.51728, 0.71932, 0.58502, 0.63061, 0.48567, 0.53322, 0.58611, 0.68741, 0.59939, 0.62614], "p50_mean": 0.7827, "p50_folds": [0.8, 0.74, 0.78, 0.92, 0.92, 0.92, 0.76, 0.58, 0.78, 0.7, 0.9, 0.6, 0.86, 0.7, 0.78], "delta": -0.00335, "wins": 6, "wilcoxon_p": 0.9527, "decision": "revert", "seconds": 1.4, "config": {"population": "visible", "target": "binary", "num_impute": "zero", "num": ["content_age_days", "days_since_last_update", "word_count", "char_count", "search_volume", "competition", "cpc", "impressions_prev_30d", "clicks_prev_30d", "sessions_prev_30d"], "derived": [], "log1p_prev": true, "log1p_extra": [], "missing_flags": ["search_volume", "word_count"], "cats": ["content_type", "main_intent", "competition_level"], "encoder": "onehot", "scaler": "maxabs", "selection": null, "sample_weight": null, "model": "logreg", "model_params": {"class_weight": "balanced", "max_iter": 2000, "C": 1.0}}}
{"stage": "preproc", "patch": "log1p_extended", "hash": "95ba35a80dfe", "auc_mean": 0.60335, "auc_std": 0.06498, "auc_folds": [0.69574, 0.6173, 0.62296, 0.53743, 0.53559, 0.517, 0.71531, 0.60117, 0.62632, 0.51036, 0.52864, 0.60053, 0.70306, 0.61363, 0.62514], "p50_mean": 0.7747, "p50_folds": [0.74, 0.72, 0.76, 0.88, 0.84, 0.86, 0.82, 0.66, 0.76, 0.76, 0.8, 0.64, 0.82, 0.78, 0.78], "delta": 0.00178, "wins": 8, "wilcoxon_p": 0.2106, "decision": "revert", "seconds": 2.4, "config": {"population": "visible", "target": "binary", "num_impute": "zero", "num": ["content_age_days", "days_since_last_update", "word_count", "char_count", "search_volume", "competition", "cpc", "impressions_prev_30d", "clicks_prev_30d", "sessions_prev_30d"], "derived": [], "log1p_prev": true, "log1p_extra": ["search_volume", "cpc", "word_count", "char_count", "content_age_days", "days_since_last_update"], "missing_flags": ["search_volume", "word_count"], "cats": ["content_type", "main_intent", "competition_level"], "encoder": "onehot", "scaler": "standard", "selection": null, "sample_weight": null, "model": "logreg", "model_params": {"class_weight": "balanced", "max_iter": 2000, "C": 1.0}}}
{"stage": "preproc", "patch": "cats_add_provider_model", "hash": "bab3c20a21cf", "auc_mean": 0.5862, "auc_std": 0.06971, "auc_folds": [0.64509, 0.60286, 0.61702, 0.61559, 0.49619, 0.4692, 0.69679, 0.59417, 0.61601, 0.50234, 0.48617, 0.59469, 0.70093, 0.54673, 0.60927], "p50_mean": 0.7427, "p50_folds": [0.56, 0.62, 0.84, 0.9, 0.9, 0.9, 0.66, 0.58, 0.86, 0.64, 0.9, 0.58, 0.78, 0.58, 0.84], "delta": -0.01536, "wins": 6, "wilcoxon_p": 0.9584, "decision": "veto_p50", "seconds": 2.0, "config": {"population": "visible", "target": "binary", "num_impute": "zero", "num": ["content_age_days", "days_since_last_update", "word_count", "char_count", "search_volume", "competition", "cpc", "impressions_prev_30d", "clicks_prev_30d", "sessions_prev_30d"], "derived": [], "log1p_prev": true, "log1p_extra": [], "missing_flags": ["search_volume", "word_count"], "cats": ["content_type", "main_intent", "competition_level", "provider_used", "model_used"], "encoder": "onehot", "scaler": "standard", "selection": null, "sample_weight": null, "model": "logreg", "model_params": {"class_weight": "balanced", "max_iter": 2000, "C": 1.0}}}
{"stage": "preproc", "patch": "cats_add_tiers", "hash": "b85c4bdef547", "auc_mean": 0.60623, "auc_std": 0.05377, "auc_folds": [0.66753, 0.62091, 0.61699, 0.59772, 0.56681, 0.53714, 0.68696, 0.58982, 0.62264, 0.54253, 0.55544, 0.58844, 0.73137, 0.55086, 0.61831], "p50_mean": 0.796, "p50_folds": [0.72, 0.78, 0.8, 0.92, 0.84, 0.86, 0.94, 0.66, 0.78, 0.58, 0.86, 0.66, 0.88, 0.84, 0.82], "delta": 0.00467, "wins": 9, "wilcoxon_p": 0.2444, "decision": "keep", "seconds": 2.4, "config": {"population": "visible", "target": "binary", "num_impute": "zero", "num": ["content_age_days", "days_since_last_update", "word_count", "char_count", "search_volume", "competition", "cpc", "impressions_prev_30d", "clicks_prev_30d", "sessions_prev_30d"], "derived": [], "log1p_prev": true, "log1p_extra": [], "missing_flags": ["search_volume", "word_count"], "cats": ["content_type", "main_intent", "competition_level", "age_tier", "freshness_tier", "word_count_tier"], "encoder": "onehot", "scaler": "standard", "selection": null, "sample_weight": null, "model": "logreg", "model_params": {"class_weight": "balanced", "max_iter": 2000, "C": 1.0}}}
{"stage": "preproc", "patch": "missing_flags_all", "hash": "870f08971d3b", "auc_mean": 0.60276, "auc_std": 0.05199, "auc_folds": [0.67197, 0.60465, 0.60044, 0.61181, 0.56788, 0.53261, 0.68351, 0.59078, 0.60011, 0.55361, 0.55261, 0.59078, 0.72849, 0.55955, 0.59256], "p50_mean": 0.7907, "p50_folds": [0.72, 0.78, 0.76, 0.9, 0.86, 0.86, 0.92, 0.62, 0.8, 0.64, 0.86, 0.62, 0.94, 0.82, 0.76], "delta": -0.00347, "wins": 7, "wilcoxon_p": 0.8349, "decision": "revert", "seconds": 2.7, "config": {"population": "visible", "target": "binary", "num_impute": "zero", "num": ["content_age_days", "days_since_last_update", "word_count", "char_count", "search_volume", "competition", "cpc", "impressions_prev_30d", "clicks_prev_30d", "sessions_prev_30d"], "derived": [], "log1p_prev": true, "log1p_extra": [], "missing_flags": ["search_volume", "word_count", "competition", "cpc", "main_intent", "provider_used", "model_used"], "cats": ["content_type", "main_intent", "competition_level", "age_tier", "freshness_tier", "word_count_tier"], "encoder": "onehot", "scaler": "standard", "selection": null, "sample_weight": null, "model": "logreg", "model_params": {"class_weight": "balanced", "max_iter": 2000, "C": 1.0}}}
{"stage": "preproc", "patch": "encoder_ordinal", "hash": "0983e195908a", "auc_mean": 0.59503, "auc_std": 0.06215, "auc_folds": [0.6702, 0.59957, 0.6231, 0.53122, 0.53639, 0.52569, 0.70948, 0.58593, 0.62814, 0.4866, 0.54061, 0.58666, 0.69171, 0.58864, 0.62154], "p50_mean": 0.7907, "p50_folds": [0.68, 0.7, 0.76, 0.92, 0.94, 0.94, 0.88, 0.6, 0.78, 0.72, 0.94, 0.62, 0.92, 0.7, 0.76], "delta": -0.0112, "wins": 6, "wilcoxon_p": 0.8961, "decision": "revert", "seconds": 1.7, "config": {"population": "visible", "target": "binary", "num_impute": "zero", "num": ["content_age_days", "days_since_last_update", "word_count", "char_count", "search_volume", "competition", "cpc", "impressions_prev_30d", "clicks_prev_30d", "sessions_prev_30d"], "derived": [], "log1p_prev": true, "log1p_extra": [], "missing_flags": ["search_volume", "word_count"], "cats": ["content_type", "main_intent", "competition_level", "age_tier", "freshness_tier", "word_count_tier"], "encoder": "ordinal", "scaler": "standard", "selection": null, "sample_weight": null, "model": "logreg", "model_params": {"class_weight": "balanced", "max_iter": 2000, "C": 1.0}}}
{"stage": "preproc", "patch": "encoder_onehot_drop", "hash": "1e12b56c366b", "auc_mean": 0.6079, "auc_std": 0.05355, "auc_folds": [0.67047, 0.62233, 0.61619, 0.60528, 0.57039, 0.54362, 0.68808, 0.58796, 0.62211, 0.536, 0.56116, 0.58623, 0.73349, 0.55732, 0.61794], "p50_mean": 0.8013, "p50_folds": [0.74, 0.76, 0.8, 0.92, 0.84, 0.88, 0.94, 0.66, 0.78, 0.62, 0.9, 0.66, 0.88, 0.82, 0.82], "delta": 0.00167, "wins": 9, "wilcoxon_p": 0.0757, "decision": "revert", "seconds": 2.6, "config": {"population": "visible", "target": "binary", "num_impute": "zero", "num": ["content_age_days", "days_since_last_update", "word_count", "char_count", "search_volume", "competition", "cpc", "impressions_prev_30d", "clicks_prev_30d", "sessions_prev_30d"], "derived": [], "log1p_prev": true, "log1p_extra": [], "missing_flags": ["search_volume", "word_count"], "cats": ["content_type", "main_intent", "competition_level", "age_tier", "freshness_tier", "word_count_tier"], "encoder": "onehot_drop", "scaler": "standard", "selection": null, "sample_weight": null, "model": "logreg", "model_params": {"class_weight": "balanced", "max_iter": 2000, "C": 1.0}}}
{"stage": "feateng", "patch": "add_prev_ratios", "hash": "6c9c271db574", "auc_mean": 0.60369, "auc_std": 0.05647, "auc_folds": [0.66918, 0.61661, 0.61611, 0.5972, 0.56086, 0.52891, 0.68824, 0.58539, 0.62242, 0.53869, 0.54734, 0.58438, 0.73382, 0.54865, 0.61751], "p50_mean": 0.7907, "p50_folds": [0.72, 0.74, 0.8, 0.92, 0.84, 0.84, 0.94, 0.64, 0.78, 0.58, 0.88, 0.64, 0.9, 0.84, 0.8], "delta": -0.00254, "wins": 3, "wilcoxon_p": 0.9925, "decision": "revert", "seconds": 2.7, "config": {"population": "visible", "target": "binary", "num_impute": "zero", "num": ["content_age_days", "days_since_last_update", "word_count", "char_count", "search_volume", "competition", "cpc", "impressions_prev_30d", "clicks_prev_30d", "sessions_prev_30d"], "derived": ["prev_ratios"], "log1p_prev": true, "log1p_extra": [], "missing_flags": ["search_volume", "word_count"], "cats": ["content_type", "main_intent", "competition_level", "age_tier", "freshness_tier", "word_count_tier"], "encoder": "onehot", "scaler": "standard", "selection": null, "sample_weight": null, "model": "logreg", "model_params": {"class_weight": "balanced", "max_iter": 2000, "C": 1.0}}}
{"stage": "feateng", "patch": "add_zero_flags", "hash": "2511971ddd55", "auc_mean": 0.60353, "auc_std": 0.06105, "auc_folds": [0.6784, 0.62308, 0.6174, 0.59181, 0.55301, 0.51734, 0.69476, 0.5882, 0.6239, 0.53442, 0.53999, 0.58793, 0.73911, 0.54821, 0.61535], "p50_mean": 0.7853, "p50_folds": [0.66, 0.78, 0.84, 0.92, 0.78, 0.84, 0.94, 0.58, 0.84, 0.6, 0.84, 0.6, 0.86, 0.9, 0.8], "delta": -0.0027, "wins": 6, "wilcoxon_p": 0.8738, "decision": "revert", "seconds": 2.5, "config": {"population": "visible", "target": "binary", "num_impute": "zero", "num": ["content_age_days", "days_since_last_update", "word_count", "char_count", "search_volume", "competition", "cpc", "impressions_prev_30d", "clicks_prev_30d", "sessions_prev_30d"], "derived": ["zero_flags"], "log1p_prev": true, "log1p_extra": [], "missing_flags": ["search_volume", "word_count"], "cats": ["content_type", "main_intent", "competition_level", "age_tier", "freshness_tier", "word_count_tier"], "encoder": "onehot", "scaler": "standard", "selection": null, "sample_weight": null, "model": "logreg", "model_params": {"class_weight": "balanced", "max_iter": 2000, "C": 1.0}}}
{"stage": "feateng", "patch": "add_staleness", "hash": "c2ed323a2111", "auc_mean": 0.60509, "auc_std": 0.05303, "auc_folds": [0.66618, 0.61457, 0.61029, 0.59862, 0.57155, 0.54137, 0.68694, 0.58764, 0.61411, 0.54167, 0.5584, 0.58667, 0.73338, 0.55089, 0.61414], "p50_mean": 0.808, "p50_folds": [0.72, 0.78, 0.82, 0.92, 0.86, 0.88, 0.94, 0.68, 0.82, 0.58, 0.88, 0.68, 0.9, 0.84, 0.82], "delta": -0.00114, "wins": 6, "wilcoxon_p": 0.8053, "decision": "revert", "seconds": 2.5, "config": {"population": "visible", "target": "binary", "num_impute": "zero", "num": ["content_age_days", "days_since_last_update", "word_count", "char_count", "search_volume", "competition", "cpc", "impressions_prev_30d", "clicks_prev_30d", "sessions_prev_30d"], "derived": ["staleness"], "log1p_prev": true, "log1p_extra": [], "missing_flags": ["search_volume", "word_count"], "cats": ["content_type", "main_intent", "competition_level", "age_tier", "freshness_tier", "word_count_tier"], "encoder": "onehot", "scaler": "standard", "selection": null, "sample_weight": null, "model": "logreg", "model_params": {"class_weight": "balanced", "max_iter": 2000, "C": 1.0}}}
{"stage": "feateng", "patch": "add_keyword_composites", "hash": "08c5c56ae89a", "auc_mean": 0.60962, "auc_std": 0.05283, "auc_folds": [0.6693, 0.62435, 0.62052, 0.6009, 0.57622, 0.53755, 0.68887, 0.59228, 0.62559, 0.55174, 0.55538, 0.59059, 0.73219, 0.55585, 0.62296], "p50_mean": 0.804, "p50_folds": [0.7, 0.78, 0.82, 0.92, 0.88, 0.86, 0.94, 0.66, 0.84, 0.62, 0.86, 0.66, 0.88, 0.82, 0.82], "delta": 0.00339, "wins": 14, "wilcoxon_p": 0.0001, "decision": "keep", "seconds": 2.7, "config": {"population": "visible", "target": "binary", "num_impute": "zero", "num": ["content_age_days", "days_since_last_update", "word_count", "char_count", "search_volume", "competition", "cpc", "impressions_prev_30d", "clicks_prev_30d", "sessions_prev_30d"], "derived": ["keyword_composites"], "log1p_prev": true, "log1p_extra": [], "missing_flags": ["search_volume", "word_count"], "cats": ["content_type", "main_intent", "competition_level", "age_tier", "freshness_tier", "word_count_tier"], "encoder": "onehot", "scaler": "standard", "selection": null, "sample_weight": null, "model": "logreg", "model_params": {"class_weight": "balanced", "max_iter": 2000, "C": 1.0}}}
{"stage": "feateng", "patch": "add_density", "hash": "513137ef1bb8", "auc_mean": 0.60419, "auc_std": 0.0551, "auc_folds": [0.67082, 0.60867, 0.6159, 0.593, 0.55918, 0.53436, 0.68704, 0.58837, 0.6224, 0.54152, 0.54969, 0.58755, 0.73235, 0.55284, 0.61923], "p50_mean": 0.8067, "p50_folds": [0.76, 0.8, 0.8, 0.9, 0.84, 0.86, 0.98, 0.68, 0.78, 0.6, 0.84, 0.68, 0.92, 0.84, 0.82], "delta": -0.00542, "wins": 2, "wilcoxon_p": 0.9999, "decision": "revert", "seconds": 2.6, "config": {"population": "visible", "target": "binary", "num_impute": "zero", "num": ["content_age_days", "days_since_last_update", "word_count", "char_count", "search_volume", "competition", "cpc", "impressions_prev_30d", "clicks_prev_30d", "sessions_prev_30d"], "derived": ["density"], "log1p_prev": true, "log1p_extra": [], "missing_flags": ["search_volume", "word_count"], "cats": ["content_type", "main_intent", "competition_level", "age_tier", "freshness_tier", "word_count_tier"], "encoder": "onehot", "scaler": "standard", "selection": null, "sample_weight": null, "model": "logreg", "model_params": {"class_weight": "balanced", "max_iter": 2000, "C": 1.0}}}
